{
  "$schema": "../../games/schema.json",
  "id": "sprint",
  "name": "Sprint",
  "listed": false,
  "board": 3,
  "clients": ["sprint"],
  "origins": [],
  "initials": { "default": "AAA" },
  "fields": {
    "time": { "type": "decimal", "required": true, "precision": 2, "min": 0.01, "max": 3600 },
    "laps": { "type": "integer", "min": 1, "max": 99, "onInvalid": "unknown" }
  },
  "ranking": [
    { "field": "laps", "order": "desc", "unknown": "first" },
    { "field": "time", "order": "asc" }
  ],
  "columns": [
    { "field": "time", "label": "Time", "format": "decimal" },
    { "field": "laps", "label": "Laps" }
  ]
}
